{
  "schema_version": 1,
  "owner": "zoo-release-board",
  "updated_at_utc": "2026-04-08T00:00:00Z",
  "notes": "Release baseline profile for controlled reference environment.",
  "benchmark_profiles": {
    "release": {
      "p99_latency_ms_max": null,
      "throughput_ops_min": 0.01,
      "jitter_ms_max": null,
      "notes": "Initial guardrail before release calibration; replace with measured release-host thresholds."
    }
  }
}